{
  "vocabulary_version": "0.1.0",
  "vocabulary_serial": 1,
  "axes": {
    "instrument": {
      "description": "What makes the sound. Grouped by family; the family is documentation and fallback scope, not part of the identity.",
      "values": [
        {
          "id": 1,
          "slug": "kick",
          "family": "kit.membrane"
        },
        {
          "id": 2,
          "slug": "snare",
          "family": "kit.membrane"
        },
        {
          "id": 3,
          "slug": "tom",
          "family": "kit.membrane"
        },
        {
          "id": 4,
          "slug": "octoban",
          "family": "kit.membrane"
        },
        {
          "id": 10,
          "slug": "hihat",
          "family": "kit.cymbal"
        },
        {
          "id": 11,
          "slug": "xhat",
          "family": "kit.cymbal"
        },
        {
          "id": 12,
          "slug": "ride",
          "family": "kit.cymbal"
        },
        {
          "id": 13,
          "slug": "crash",
          "family": "kit.cymbal"
        },
        {
          "id": 14,
          "slug": "china",
          "family": "kit.cymbal"
        },
        {
          "id": 15,
          "slug": "splash",
          "family": "kit.cymbal"
        },
        {
          "id": 16,
          "slug": "stack",
          "family": "kit.cymbal"
        },
        {
          "id": 17,
          "slug": "bell",
          "family": "kit.cymbal"
        },
        {
          "id": 18,
          "slug": "cymbal",
          "family": "kit.cymbal"
        },
        {
          "id": 19,
          "slug": "mini-china",
          "family": "kit.cymbal"
        },
        {
          "id": 20,
          "slug": "mini-hihat",
          "family": "kit.cymbal"
        },
        {
          "id": 21,
          "slug": "crash-ride",
          "family": "kit.cymbal"
        },
        {
          "id": 22,
          "slug": "sizzle-ride",
          "family": "kit.cymbal"
        },
        {
          "id": 30,
          "slug": "cowbell",
          "family": "kit.aux"
        },
        {
          "id": 31,
          "slug": "jam-block",
          "family": "kit.aux"
        },
        {
          "id": 32,
          "slug": "woodblock",
          "family": "kit.aux"
        },
        {
          "id": 33,
          "slug": "tambourine",
          "family": "kit.aux"
        },
        {
          "id": 34,
          "slug": "sticks",
          "family": "kit.aux"
        },
        {
          "id": 35,
          "slug": "clap",
          "family": "kit.aux"
        },
        {
          "id": 36,
          "slug": "shaker",
          "family": "kit.aux"
        },
        {
          "id": 37,
          "slug": "triangle",
          "family": "kit.aux"
        },
        {
          "id": 38,
          "slug": "chimes",
          "family": "kit.aux"
        },
        {
          "id": 39,
          "slug": "aux-pad",
          "family": "kit.aux"
        }
      ],
      "reserved_families": [
        "perc.hand",
        "perc.shaken",
        "perc.scraped",
        "perc.struck-idiophone",
        "perc.wind",
        "orch",
        "electronic",
        "utility",
        "unknown"
      ]
    },
    "site": {
      "description": "Contact site ON THE INSTRUMENT. Distinct from `contact`, which is the part of the implement. PAL splits these and real layouts contain both.",
      "values": [
        {
          "id": 1,
          "slug": "head"
        },
        {
          "id": 2,
          "slug": "rim"
        },
        {
          "id": 3,
          "slug": "rim2"
        },
        {
          "id": 4,
          "slug": "crossstick"
        },
        {
          "id": 5,
          "slug": "shell"
        },
        {
          "id": 6,
          "slug": "bow"
        },
        {
          "id": 7,
          "slug": "edge"
        },
        {
          "id": 8,
          "slug": "bell"
        },
        {
          "id": 9,
          "slug": "underside"
        }
      ]
    },
    "position": {
      "description": "Where on the site, radially. Also expressible continuously through the strike_position controllers.",
      "values": [
        {
          "id": 1,
          "slug": "centre"
        },
        {
          "id": 2,
          "slug": "halfway"
        },
        {
          "id": 3,
          "slug": "offset"
        },
        {
          "id": 4,
          "slug": "perimeter"
        }
      ]
    },
    "contact": {
      "description": "Part of the implement that touches. Orthogonal to `site`: Superior Drummer ships Bow Tip, Bow Shank, Bell Tip and Bell Shank.",
      "values": [
        {
          "id": 1,
          "slug": "tip"
        },
        {
          "id": 2,
          "slug": "shank"
        },
        {
          "id": 3,
          "slug": "butt"
        }
      ]
    },
    "technique": {
      "description": "The stroke itself. `choke` is deliberately absent: it is a relation on a previously sounded event, not a stroke. See vocabulary/rules.json.",
      "values": [
        {
          "id": 1,
          "slug": "hit"
        },
        {
          "id": 2,
          "slug": "rimshot"
        },
        {
          "id": 3,
          "slug": "rim-only"
        },
        {
          "id": 4,
          "slug": "sidestick"
        },
        {
          "id": 5,
          "slug": "stick-shot"
        },
        {
          "id": 6,
          "slug": "back-stick"
        },
        {
          "id": 7,
          "slug": "ping-shot"
        },
        {
          "id": 8,
          "slug": "gok-shot"
        },
        {
          "id": 9,
          "slug": "slap"
        },
        {
          "id": 10,
          "slug": "open-tone"
        },
        {
          "id": 11,
          "slug": "bass-tone"
        },
        {
          "id": 12,
          "slug": "mute-stroke"
        },
        {
          "id": 13,
          "slug": "heel"
        },
        {
          "id": 14,
          "slug": "toe"
        },
        {
          "id": 15,
          "slug": "thumb"
        },
        {
          "id": 16,
          "slug": "sweep"
        },
        {
          "id": 17,
          "slug": "swirl"
        },
        {
          "id": 18,
          "slug": "circling"
        },
        {
          "id": 19,
          "slug": "scrape"
        },
        {
          "id": 20,
          "slug": "shake"
        },
        {
          "id": 21,
          "slug": "gliss"
        },
        {
          "id": 22,
          "slug": "dead"
        },
        {
          "id": 23,
          "slug": "chick"
        },
        {
          "id": 24,
          "slug": "foot-splash"
        }
      ]
    },
    "ornament": {
      "description": "Grace or multi-stroke qualifier. `attacks` lets the expansion rules find compound strokes mechanically: a flam is one note in a library and two notes in a performance.",
      "values": [
        {
          "id": 1,
          "slug": "flam",
          "attacks": 2
        },
        {
          "id": 2,
          "slug": "drag",
          "attacks": 3
        },
        {
          "id": 3,
          "slug": "ruff",
          "attacks": 4
        },
        {
          "id": 4,
          "slug": "bounced",
          "attacks": 2
        },
        {
          "id": 5,
          "slug": "roll",
          "attacks": 0
        },
        {
          "id": 6,
          "slug": "buzz",
          "attacks": 0
        },
        {
          "id": 7,
          "slug": "crescendo",
          "attacks": 0
        },
        {
          "id": 8,
          "slug": "swell",
          "attacks": 0
        },
        {
          "id": 9,
          "slug": "wash",
          "attacks": 0
        }
      ],
      "value_meaning": "attacks: number of contacts, 0 = sustained/indeterminate"
    },
    "openness": {
      "description": "Ordered state. The named anchors are labels for bands of one normalised scalar, 0.0 fully closed to 1.0 fully open, so a four-level device and a six-level device project onto the same axis without inventing terms. This is the same axis the hi-hat pedal CC measures.",
      "values": [
        {
          "id": 0,
          "slug": "tight",
          "scalar": 0.0
        },
        {
          "id": 1,
          "slug": "closed",
          "scalar": 0.12
        },
        {
          "id": 2,
          "slug": "closed-loose",
          "scalar": 0.2
        },
        {
          "id": 3,
          "slug": "quarter",
          "scalar": 0.25
        },
        {
          "id": 4,
          "slug": "half",
          "scalar": 0.5
        },
        {
          "id": 5,
          "slug": "three-quarter",
          "scalar": 0.75
        },
        {
          "id": 6,
          "slug": "loose",
          "scalar": 0.85
        },
        {
          "id": 7,
          "slug": "open",
          "scalar": 1.0
        }
      ],
      "value_meaning": "scalar: position on the normalised openness axis"
    },
    "damping": {
      "description": "What damps and when, applied AT the strike. PAL shows this is not a bare scalar: hand damping while striking and while not striking are different sounds. Distinct from the choke relation, which is applied after.",
      "values": [
        {
          "id": 0,
          "slug": "none"
        },
        {
          "id": 1,
          "slug": "muted"
        },
        {
          "id": 2,
          "slug": "damped"
        },
        {
          "id": 3,
          "slug": "towel"
        },
        {
          "id": 4,
          "slug": "gated"
        }
      ]
    },
    "mechanism": {
      "description": "Device state that is not damping. Snares off is a resonating mechanism being disengaged, not a mute.",
      "values": [
        {
          "id": 0,
          "slug": "wires-on"
        },
        {
          "id": 1,
          "slug": "wires-off"
        },
        {
          "id": 2,